"channelTitle","videoId","videoTitle","release_date","release_time","duration","codeSubject","viewCount","likeCount","commentCount","defaultLAudioLanguage","videoDescription","tags","videoCategoryId","videoCategoryLabel","topicCategories","caption"
"Corey Schafer","a6fIbtFB46g","Python Tutorial: Web Scraping with Requests-HTML",2019-03-11,"20:15:02","56:27","Python",187118,3447,203,"en","In this Python Programming Tutorial, we will be learning how to scrape websites using the Requests-HTML library. Requests-HTML is an excellent tool for parsing HTML code and grabbing exactly the information you need. So whether you're pulling down headlines from news sites, scores from sports websites, or prices from an online store... Requests-HTML and Python will help you get this done quickly and easily. Let's get started... The code from this video can be found at: https://github.com/CoreyMSchafer/code_snippets/tree/master/Python/Requests-HTML File Objects Tutorial - https://youtu.be/Uh2ebFW8OYM Requests Tutorial - https://youtu.be/tb8gHvYlCFs F-Strings Tutorial - https://youtu.be/nghuHvKLhJA Try/Except Tutorial - https://youtu.be/NIWwJbo-9_8 CSV Tutorial - https://youtu.be/q5uM4VKywbA ✅ Support My Channel Through Patreon: https://www.patreon.com/coreyms ✅ Become a Channel Member: https://www.youtube.com/channel/UCCezIgC97PvUuR4_gbFUs5g/join ✅ One-Time Contribution Through PayPal: https://goo.gl/649HFY ✅ Cryptocurrency Donations: Bitcoin Wallet - 3MPH8oY2EAgbLVy7RBMinwcBntggi7qeG3 Ethereum Wallet - 0x151649418616068fB46C3598083817101d3bCD33 Litecoin Wallet - MPvEBY5fxGkmPQgocfJbxP6EmTo5UUXMot ✅ Corey's Public Amazon Wishlist http://a.co/inIyro1 ✅ Equipment I Use and Books I Recommend: https://www.amazon.com/shop/coreyschafer ▶️ You Can Find Me On: My Website - http://coreyms.com/ My Second Channel - https://www.youtube.com/c/coreymschafer Facebook - https://www.facebook.com/CoreyMSchafer Twitter - https://twitter.com/CoreyMSchafer Instagram - https://www.instagram.com/coreymschafer/ #Python #Requests","python,requests-html tutorial,requests-html,requests,python requests,python requests-html,web scraping,scraping,python html,python html parsing,web crawler,string parsing,parse html,python csv,corey schafer,python3,programming tutorial,requests library,python web scraping,python tutorial,python web scraping tutorial",27,"Education","Knowledge,Technology","false"
"Corey Schafer","yqm6MBt-yfY","Python Tutorial: Write a Script to Monitor a Website, Send Alert Emails, and Reboot Servers",2019-03-04,"18:45:00","45:59","Python",154031,2936,103,"en","In this Python Programming Tutorial, we're going to be looking at a real-world example of writing a script to monitor a website. If the website doesn't return a successful response for any reason then we will send an email and reboot the web server. Let's get started... The code from this video (with added logging) can be found at: http://bit.ly/monitor-script Google Account Settings: https://myaccount.google.com/lesssecureapps https://myaccount.google.com/apppasswords Requests Video - https://youtu.be/tb8gHvYlCFs Environment Variables (Windows) - https://youtu.be/IolxqkL7cD8 Environment Variables (Mac and Linux) - https://youtu.be/5iWhQWVXosU Try/Except Video - https://youtu.be/NIWwJbo-9_8 F-String Video - https://youtu.be/nghuHvKLhJA Crontab Video - https://youtu.be/QZJ1drMQz1A ✅ Support My Channel Through Patreon: https://www.patreon.com/coreyms ✅ Become a Channel Member: https://www.youtube.com/channel/UCCezIgC97PvUuR4_gbFUs5g/join ✅ One-Time Contribution Through PayPal: https://goo.gl/649HFY ✅ Cryptocurrency Donations: Bitcoin Wallet - 3MPH8oY2EAgbLVy7RBMinwcBntggi7qeG3 Ethereum Wallet - 0x151649418616068fB46C3598083817101d3bCD33 Litecoin Wallet - MPvEBY5fxGkmPQgocfJbxP6EmTo5UUXMot ✅ Corey's Public Amazon Wishlist http://a.co/inIyro1 ✅ Equipment I Use and Books I Recommend: https://www.amazon.com/shop/coreyschafer ▶️ You Can Find Me On: My Website - http://coreyms.com/ My Second Channel - https://www.youtube.com/c/coreymschafer Facebook - https://www.facebook.com/CoreyMSchafer Twitter - https://twitter.com/CoreyMSchafer Instagram - https://www.instagram.com/coreymschafer/ #Python","python,script,python script,monitor,requests,smtplib,email,linode,server reboot,python tutorial,python (programming language),website monitoring,corey schafer,python programming,python email,python linode,python sys admin,system administration,python monitor script,linode python library,using requests,requests tutorial",27,"Education","Knowledge,Technology","false"
"Corey Schafer","tb8gHvYlCFs","Python Requests Tutorial: Request Web Pages, Download Images, POST Data, Read JSON, and More",2019-02-26,"15:45:00","25:01","Python",969465,18917,505,"en","In this Python Programming Tutorial, we will be learning how to use the Requests library. The Requests library allows us to send HTTP requests and interact with web pages. We will be learning how to grab the source code of a site, download images, POST form data to routes, read JSON responses, perform authentication, and more. Let's get started... BeautifulSoup Tutorial - https://youtu.be/ng2o98k983k File Objects Tutorial - https://youtu.be/Uh2ebFW8OYM ✅ Support My Channel Through Patreon: https://www.patreon.com/coreyms ✅ Become a Channel Member: https://www.youtube.com/channel/UCCezIgC97PvUuR4_gbFUs5g/join ✅ One-Time Contribution Through PayPal: https://goo.gl/649HFY ✅ Cryptocurrency Donations: Bitcoin Wallet - 3MPH8oY2EAgbLVy7RBMinwcBntggi7qeG3 Ethereum Wallet - 0x151649418616068fB46C3598083817101d3bCD33 Litecoin Wallet - MPvEBY5fxGkmPQgocfJbxP6EmTo5UUXMot ✅ Corey's Public Amazon Wishlist http://a.co/inIyro1 ✅ Equipment I Use and Books I Recommend: https://www.amazon.com/shop/coreyschafer ▶️ You Can Find Me On: My Website - http://coreyms.com/ My Second Channel - https://www.youtube.com/c/coreymschafer Facebook - https://www.facebook.com/CoreyMSchafer Twitter - https://twitter.com/CoreyMSchafer Instagram - https://www.instagram.com/coreymschafer/ #Python #Requests","python,requests,python requests,requests tutorial,using requests,learn requests,HTTP,HTTP requests,GET,POST,PUT,DELETE,web scraping,download image,API,APIs,JSON,requests library,log in,login,basic auth,basic authentication,python 3,python tutorial,python programming,corey schafer,how to use requests,request",27,"Education","Knowledge,Technology","true"
"Corey Schafer","6DI_7Zja8Zc","Python Django Tutorial: Deploying Your Application (Option #2) - Deploy using Heroku",2019-02-19,"17:30:01","53:31","Python",279958,4790,672,"en","In this Python Django Tutorial, we will be learning how to deploy our application to Heroku. Heroku is a platform that abstracts away a lot of the low-level system administration and allows us to easily deploy, update, and rollback changes for our application. Let's get started... Git Install - https://git-scm.com/downloads Heroku CLI Install - http://bit.ly/heroku-cli Postgres Install - http://bit.ly/heroku-postgres My requirements.txt file - http://bit.ly/django-req-txt-file Git Command-Line Fundamentals - https://youtu.be/HVsySz-h9r4 Gitignore file (Python) - http://bit.ly/py-ignore Environment Variables (Windows) - https://youtu.be/IolxqkL7cD8 Environment Variables (Mac and Linux) - https://youtu.be/5iWhQWVXosU ✅ Support My Channel Through Patreon: https://www.patreon.com/coreyms ✅ Become a Channel Member: https://www.youtube.com/channel/UCCezIgC97PvUuR4_gbFUs5g/join ✅ One-Time Contribution Through PayPal: https://goo.gl/649HFY ✅ Cryptocurrency Donations: Bitcoin Wallet - 3MPH8oY2EAgbLVy7RBMinwcBntggi7qeG3 Ethereum Wallet - 0x151649418616068fB46C3598083817101d3bCD33 Litecoin Wallet - MPvEBY5fxGkmPQgocfJbxP6EmTo5UUXMot ✅ Corey's Public Amazon Wishlist http://a.co/inIyro1 ✅ Equipment I Use and Books I Recommend: https://www.amazon.com/shop/coreyschafer ▶️ You Can Find Me On: My Website - http://coreyms.com/ My Second Channel - https://www.youtube.com/c/coreymschafer Facebook - https://www.facebook.com/CoreyMSchafer Twitter - https://twitter.com/CoreyMSchafer Instagram - https://www.instagram.com/coreymschafer/ #Python #Django","python,django,django deployment,django heroku,heroku,deploy to heroku,django deploy heroku,django tutorial,python django,deploy django,django deployment tutorial,django deployment heroku,gunicorn,django gunicorn,django 2,django 2.1,heroku tutorial,python heroku,heroku python,heroku django,postgres,heroku postgres,heroku cli,python tutorial,web development,corey schafer",27,"Education","Knowledge,Technology","false"
"Corey Schafer","kt3ZtW9MXhw","Python Django Tutorial: Full-Featured Web App Part 13 - Using AWS S3 for File Uploads",2019-02-18,"20:15:01","26:35","Python",153905,2473,470,"en","In this Python Django Tutorial, we will be learning how to set up AWS S3 so that we can host our media files from that service instead of our local filesystem. AWS S3 is very affordable and will also allow our application to scale much more than if our files lived on our local filesystem. Let's get started... The code for this series can be found at: https://github.com/CoreyMSchafer/code_snippets/tree/master/Django_Blog S3 CORS Config - http://bit.ly/cors-config Environment Variables (Windows): https://youtu.be/IolxqkL7cD8 Environment Variables (Mac and Linux): https://youtu.be/5iWhQWVXosU ✅ Support My Channel Through Patreon: https://www.patreon.com/coreyms ✅ Become a Channel Member: https://www.youtube.com/channel/UCCezIgC97PvUuR4_gbFUs5g/join ✅ One-Time Contribution Through PayPal: https://goo.gl/649HFY ✅ Cryptocurrency Donations: Bitcoin Wallet - 3MPH8oY2EAgbLVy7RBMinwcBntggi7qeG3 Ethereum Wallet - 0x151649418616068fB46C3598083817101d3bCD33 Litecoin Wallet - MPvEBY5fxGkmPQgocfJbxP6EmTo5UUXMot ✅ Corey's Public Amazon Wishlist http://a.co/inIyro1 ✅ Equipment I Use and Books I Recommend: https://www.amazon.com/shop/coreyschafer ▶️ You Can Find Me On: My Website - http://coreyms.com/ My Second Channel - https://www.youtube.com/c/coreymschafer Facebook - https://www.facebook.com/CoreyMSchafer Twitter - https://twitter.com/CoreyMSchafer Instagram - https://www.instagram.com/coreymschafer/ #Python #Django","python,django,aws,s3,django 2,django 2.0,django 2.1,django version 2,django aws,django s3,django aws s3,django s3 file upload,django s3 heroku,django tutorial,aws s3,aws python boto,aws python tutorial,corey schafer,python tutorial,python programming,web development",27,"Education","Knowledge,Technology","false"
"Corey Schafer","NhidVhNHfeU","Python Django Tutorial: How to enable HTTPS with a free SSL/TLS Certificate using Let's Encrypt",2019-01-24,"18:45:01","20:47","Python",141665,2313,203,"en","In this Python Django Tutorial, we will be learning how to enable HTTPS on our web server with a free SSL/TLS certificate using a service called ""Let's Encrypt"". Let’s Encrypt is a Certificate Authority that lets anyone obtain, renew, and manage certificates for their site. They're a non-profit and provide all of this for free, and it's easy to get running on our server, so let's go ahead and get started... I am using Linode to host my site: http://bit.ly/cms-linode Apache/Ubuntu Certbot Commands: http://bit.ly/apache-certbot How to use Crontab and Cron Jobs: https://youtu.be/QZJ1drMQz1A ✅ Support My Channel Through Patreon: https://www.patreon.com/coreyms ✅ Become a Channel Member: https://www.youtube.com/channel/UCCezIgC97PvUuR4_gbFUs5g/join ✅ One-Time Contribution Through PayPal: https://goo.gl/649HFY ✅ Cryptocurrency Donations: Bitcoin Wallet - 3MPH8oY2EAgbLVy7RBMinwcBntggi7qeG3 Ethereum Wallet - 0x151649418616068fB46C3598083817101d3bCD33 Litecoin Wallet - MPvEBY5fxGkmPQgocfJbxP6EmTo5UUXMot ✅ Corey's Public Amazon Wishlist http://a.co/inIyro1 ✅ Equipment I Use and Books I Recommend: https://www.amazon.com/shop/coreyschafer ▶️ You Can Find Me On: My Website - http://coreyms.com/ My Second Channel - https://www.youtube.com/c/coreymschafer Facebook - https://www.facebook.com/CoreyMSchafer Twitter - https://twitter.com/CoreyMSchafer Instagram - https://www.instagram.com/coreymschafer/ #Python #Django","python,django,ssl,tls,let's encrypt,lets encrypt,apache,ubuntu,ubuntu 18.04,letsencrypt apache,let's encrypt apache,let's encrypt ubuntu,certbot,ssl certificate,https,how to https,tls certificate,secure site,free ssl,web development,corey schafer,linode,linux,https tutorial,ssl tutorial,certbot tutorial",27,"Education","Knowledge,Technology","false"
"Corey Schafer","Gdys9qPjuKs","Python Flask Tutorial: How to enable HTTPS with a free SSL/TLS Certificate using Let's Encrypt",2019-01-24,"18:30:00","17:14","Python",129871,2192,164,"en","In this Python Flask Tutorial, we will be learning how to enable HTTPS on our web server with a free SSL/TLS certificate using a service called ""Let's Encrypt"". Let’s Encrypt is a Certificate Authority that lets anyone obtain, renew, and manage certificates for their site. They're a non-profit and provide all of this for free, and it's easy to get running on our server, so let's go ahead and get started... I am using Linode to host my site: http://bit.ly/cms-linode Nginx/Ubuntu Certbot Commands: http://bit.ly/nginx-certbot How to use Crontab and Cron Jobs: https://youtu.be/QZJ1drMQz1A ✅ Support My Channel Through Patreon: https://www.patreon.com/coreyms ✅ Become a Channel Member: https://www.youtube.com/channel/UCCezIgC97PvUuR4_gbFUs5g/join ✅ One-Time Contribution Through PayPal: https://goo.gl/649HFY ✅ Cryptocurrency Donations: Bitcoin Wallet - 3MPH8oY2EAgbLVy7RBMinwcBntggi7qeG3 Ethereum Wallet - 0x151649418616068fB46C3598083817101d3bCD33 Litecoin Wallet - MPvEBY5fxGkmPQgocfJbxP6EmTo5UUXMot ✅ Corey's Public Amazon Wishlist http://a.co/inIyro1 ✅ Equipment I Use and Books I Recommend: https://www.amazon.com/shop/coreyschafer ▶️ You Can Find Me On: My Website - http://coreyms.com/ My Second Channel - https://www.youtube.com/c/coreymschafer Facebook - https://www.facebook.com/CoreyMSchafer Twitter - https://twitter.com/CoreyMSchafer Instagram - https://www.instagram.com/coreymschafer/ #Python #Flask","python,flask,ssl,tls,let's encrypt,lets encrypt,nginx,ubuntu,ubuntu 18.04,letsencrypt nginx,let's encrypt nginx,let's encrypt ubuntu,certbot,ssl certificate,https,how to https,tls certificate,secure site,free ssl,web development,corey schafer,linode,linux,https tutorial,ssl tutorial,certbot tutorial",27,"Education","Knowledge,Technology","false"
"Corey Schafer","D2lwk1Ukgz0","Python Django Tutorial: How to Use a Custom Domain Name for Our Application",2019-01-17,"17:45:00","27:18","Python",127371,1892,95,"en","In this Python Django Tutorial, we will be learning how to set up a custom domain name for our application. We will use NameCheap as our domain registrar and Linode to host our server. Let's get started... If you would like $20 of free credit towards a Linode account, then you can use my link here to sign up: https://linode.com/coreyschafer Buy a domain at NameCheap: https://namecheap.pxf.io/c/1358746/408749/5618 Linode DNS Documentation: https://linode.com/docs/platform/manager/dns-manager-new-manager/ ✅ Support My Channel Through Patreon: https://www.patreon.com/coreyms ✅ Become a Channel Member: https://www.youtube.com/channel/UCCezIgC97PvUuR4_gbFUs5g/join ✅ One-Time Contribution Through PayPal: https://goo.gl/649HFY ✅ Cryptocurrency Donations: Bitcoin Wallet - 3MPH8oY2EAgbLVy7RBMinwcBntggi7qeG3 Ethereum Wallet - 0x151649418616068fB46C3598083817101d3bCD33 Litecoin Wallet - MPvEBY5fxGkmPQgocfJbxP6EmTo5UUXMot ✅ Corey's Public Amazon Wishlist http://a.co/inIyro1 ✅ Equipment I Use and Books I Recommend: https://www.amazon.com/shop/coreyschafer ▶️ You Can Find Me On: My Website - http://coreyms.com/ My Second Channel - https://www.youtube.com/c/coreymschafer Facebook - https://www.facebook.com/CoreyMSchafer Twitter - https://twitter.com/CoreyMSchafer Instagram - https://www.instagram.com/coreymschafer/ #Python #Django","python,django,domain,domain name,namecheap,custom domain,django domain,linode domain,linode domain name,linux,django deployment,django web framework (software),django tutorial,python django,web development,python django tutorial,corey schafer,python tutorial,django 2,how to deploy django,dns",27,"Education","Knowledge,Technology","false"
"Corey Schafer","LUFn-QVcmB8","Python Flask Tutorial: How to Use a Custom Domain Name for Our Application",2019-01-17,"17:30:01","24:00","Python",105082,1714,81,"en","In this Python Flask Tutorial, we will be learning how to set up a custom domain name for our application. We will use NameCheap as our domain registrar and Linode to host our server. Let's get started... If you would like $20 of free credit towards a Linode account, then you can use my link here to sign up: https://linode.com/coreyschafer Buy a domain at NameCheap: https://namecheap.pxf.io/c/1358746/408749/5618 Linode DNS Documentation: https://linode.com/docs/platform/manager/dns-manager-new-manager/ ✅ Support My Channel Through Patreon: https://www.patreon.com/coreyms ✅ Become a Channel Member: https://www.youtube.com/channel/UCCezIgC97PvUuR4_gbFUs5g/join ✅ One-Time Contribution Through PayPal: https://goo.gl/649HFY ✅ Cryptocurrency Donations: Bitcoin Wallet - 3MPH8oY2EAgbLVy7RBMinwcBntggi7qeG3 Ethereum Wallet - 0x151649418616068fB46C3598083817101d3bCD33 Litecoin Wallet - MPvEBY5fxGkmPQgocfJbxP6EmTo5UUXMot ✅ Corey's Public Amazon Wishlist http://a.co/inIyro1 ✅ Equipment I Use and Books I Recommend: https://www.amazon.com/shop/coreyschafer ▶️ You Can Find Me On: My Website - http://coreyms.com/ My Second Channel - https://www.youtube.com/c/coreymschafer Facebook - https://www.facebook.com/CoreyMSchafer Twitter - https://twitter.com/CoreyMSchafer Instagram - https://www.instagram.com/coreymschafer/ #Python #Flask","python,flask,domain,domain name,namecheap,custom domain,flask domain,linode domain,linode domain name,linux,flask deployment,web development (interest),python (programming language),web development,flask tutorial,python tutorial,corey schafer,python programming,how to deploy flask,linode,dns",27,"Education","Knowledge,Technology","false"
"Corey Schafer","goToXTC96Co","Python Flask Tutorial: Deploying Your Application (Option #1) - Deploy to a Linux Server",2018-12-20,"17:45:00","15:00","Python",336997,5614,657,"en","In this Python Flask Tutorial, we will be learning how to deploy our application to a Linux Server from scratch using Linode. If you would like $20 of free credit towards a Linode account, then you can use my link here to sign up: https://linode.com/coreyschafer We will be covering the entire deployment of a Flask application. This includes spinning up a new Linux Server and tightening its security with SSH keys and firewalls. Then we will install Nginx and Gunicorn so that we can get our Flask App running. Let's get started... To skip the server setup, jump to 26:48 How to Run Linux/Bash on Windows: https://youtu.be/xzgwDbe7foQ SSH Key-Based Authentication Tutorial: https://youtu.be/vpk_1gldOAE SSH Keys on Windows: https://www.linode.com/docs/security/authentication/use-public-key-authentication-with-ssh/#windows NGINX config used in this video: https://github.com/CoreyMSchafer/code_snippets/blob/master/Python/Flask_Blog/snippets/nginx.conf Supervisor config used in this video: https://github.com/CoreyMSchafer/code_snippets/blob/master/Python/Flask_Blog/snippets/supervisor.conf ✅ Support My Channel Through Patreon: https://www.patreon.com/coreyms ✅ Become a Channel Member: https://www.youtube.com/channel/UCCezIgC97PvUuR4_gbFUs5g/join ✅ One-Time Contribution Through PayPal: https://goo.gl/649HFY ✅ Cryptocurrency Donations: Bitcoin Wallet - 3MPH8oY2EAgbLVy7RBMinwcBntggi7qeG3 Ethereum Wallet - 0x151649418616068fB46C3598083817101d3bCD33 Litecoin Wallet - MPvEBY5fxGkmPQgocfJbxP6EmTo5UUXMot ✅ Corey's Public Amazon Wishlist http://a.co/inIyro1 ✅ Equipment I Use and Books I Recommend: https://www.amazon.com/shop/coreyschafer ▶️ You Can Find Me On: My Website - http://coreyms.com/ My Second Channel - https://www.youtube.com/c/coreymschafer Facebook - https://www.facebook.com/CoreyMSchafer Twitter - https://twitter.com/CoreyMSchafer Instagram - https://www.instagram.com/coreymschafer/ #Python #Flask","python,flask,nginx,gunicorn,linux,flask deployment,flask deployment tutorial,flask tutorial,flask gunicorn,flask nginx,flask deploy,flask deployment linux,deploy flask app ubuntu,deploy flask app on ubuntu server,flask deploy ubuntu,linode,flask linode,corey schafer,how to deploy flask,how to deploy flask app on server,flask server,deploy flask,flask application,python flask,flask (software),python tutorial",27,"Education","Knowledge,Technology","false"
"Corey Schafer","Sa_kQheCnds","Python Django Tutorial: Deploying Your Application (Option #1) - Deploy to a Linux Server",2018-12-13,"19:00:02","22:01","Python",413063,6390,852,"en-US","In this Python Django Tutorial, we will be learning how to deploy our application to a Linux Server from scratch using Linode. If you would like $20 of free credit towards a Linode account, then you can use my link here to sign up: https://linode.com/coreyschafer We will be covering the entire deployment of a Django application. This includes spinning up a new Linux Server and tightening its security with SSH keys and firewalls. Then we will install Apache and Mod_WSGI so that we can get our Django App running. Let's get started... To skip the server setup, jump to 29:11 How to Run Linux/Bash on Windows: https://youtu.be/xzgwDbe7foQ SSH Key-Based Authentication Tutorial: https://youtu.be/vpk_1gldOAE SSH Keys on Windows: https://www.linode.com/docs/security/authentication/use-public-key-authentication-with-ssh/#windows Apache config used in this video: https://github.com/CoreyMSchafer/code_snippets/blob/master/Django_Blog/snippets/django_project.conf ✅ Support My Channel Through Patreon: https://www.patreon.com/coreyms ✅ Become a Channel Member: https://www.youtube.com/channel/UCCezIgC97PvUuR4_gbFUs5g/join ✅ One-Time Contribution Through PayPal: https://goo.gl/649HFY ✅ Cryptocurrency Donations: Bitcoin Wallet - 3MPH8oY2EAgbLVy7RBMinwcBntggi7qeG3 Ethereum Wallet - 0x151649418616068fB46C3598083817101d3bCD33 Litecoin Wallet - MPvEBY5fxGkmPQgocfJbxP6EmTo5UUXMot ✅ Corey's Public Amazon Wishlist http://a.co/inIyro1 ✅ Equipment I Use and Books I Recommend: https://www.amazon.com/shop/coreyschafer ▶️ You Can Find Me On: My Website - http://coreyms.com/ My Second Channel - https://www.youtube.com/c/coreymschafer Facebook - https://www.facebook.com/CoreyMSchafer Twitter - https://twitter.com/CoreyMSchafer Instagram - https://www.instagram.com/coreymschafer/ #Python #Django","python,django,django deployment,django deployment tutorial,django deploy,django deployment linux,django deployment ubuntu,django apache,django mod_wsgi,mod_wsgi,mod_wsgi apache,apache,django 2,django 2.1,django version 2,django tutorial,python django tutorial,linode,django linode,corey schafer,how to deploy django,django server,deploy django,python django,web development,django 2.0",27,"Education","Knowledge,Technology","false"
"Corey Schafer","Qu3dThVy6KQ","Python Tutorial: Itertools Module - Iterator Functions for Efficient Looping",2018-11-13,"16:35:00","45:49","Python",219848,5854,233,"en","In this Python Programming Tutorial, we will be learning about the itertools module. The itertools module is a collection of functions that allows us to work with iterators in an efficient way. Depending on your problem, this can save you a lot of memory and also a lot of work. Let's get started... Functions Covered in This Video: count - 1:19 zip_longest - 6:48 cycle - 9:17 repeat - 11:09 starmap - 14:06 combinations - 15:34 permutations - 15:34 product - 19:45 chain - 21:40 islice - 23:37 compress - 28:50 filterfalse - 31:49 dropwhile - 32:24 takewhile - 32:24 accumulate - 34:54 groupby - 37:04 tee - 43:28 The code from this video can be found at: https://github.com/CoreyMSchafer/code_snippets/tree/master/Python/Itertools Iterators Tutorial: https://youtu.be/jTYiNjvnHZY Sorting Tutorial: https://youtu.be/D3JvDWO-BY4 ✅ Support My Channel Through Patreon: https://www.patreon.com/coreyms ✅ Become a Channel Member: https://www.youtube.com/channel/UCCezIgC97PvUuR4_gbFUs5g/join ✅ One-Time Contribution Through PayPal: https://goo.gl/649HFY ✅ Cryptocurrency Donations: Bitcoin Wallet - 3MPH8oY2EAgbLVy7RBMinwcBntggi7qeG3 Ethereum Wallet - 0x151649418616068fB46C3598083817101d3bCD33 Litecoin Wallet - MPvEBY5fxGkmPQgocfJbxP6EmTo5UUXMot ✅ Corey's Public Amazon Wishlist http://a.co/inIyro1 ✅ Equipment I Use and Books I Recommend: https://www.amazon.com/shop/coreyschafer ▶️ You Can Find Me On: My Website - http://coreyms.com/ My Second Channel - https://www.youtube.com/c/coreymschafer Facebook - https://www.facebook.com/CoreyMSchafer Twitter - https://twitter.com/CoreyMSchafer Instagram - https://www.instagram.com/coreymschafer/ #Python #Itertools","python,itertools,iterator,iterable,python itertools,count,zip_longest,cycle,repeat,starmap,combinations,permutations,product,chain,islice,compress,filterfalse,dropwhile,takewhile,accumulate,groupby,tee,data science,generators,python tutorial,python (programming language),python iterators,python programming,python next,corey schafer",27,"Education","Knowledge,Technology","false"
