"channelTitle","videoId","videoTitle","release_date","release_time","duration","codeSubject","viewCount","likeCount","commentCount","defaultLAudioLanguage","videoDescription","tags","videoCategoryId","videoCategoryLabel","topicCategories","caption"
"Corey Schafer","-aKFBoZpiqA","Python Tutorial: Context Managers - Efficiently Managing Resources",2017-12-20,"18:00:00","20:37","Python",178392,5916,166,"en","In this Python Programming Tutorial, we will be learning how to use context managers to properly manage resources. Context Managers are great for when we need to setup or teardown some resources during use. So these can be used for: open and closing files, opening and closing database connections, acquiring and releasing locks, and much much more. Let's get started... The code from this video can be found at: https://github.com/CoreyMSchafer/code_snippets/tree/master/Python-Context-Managers Python Object-Oriented Series: https://goo.gl/ZSqx6y ✅ Support My Channel Through Patreon: https://www.patreon.com/coreyms ✅ Become a Channel Member: https://www.youtube.com/channel/UCCezIgC97PvUuR4_gbFUs5g/join ✅ One-Time Contribution Through PayPal: https://goo.gl/649HFY ✅ Cryptocurrency Donations: Bitcoin Wallet - 3MPH8oY2EAgbLVy7RBMinwcBntggi7qeG3 Ethereum Wallet - 0x151649418616068fB46C3598083817101d3bCD33 Litecoin Wallet - MPvEBY5fxGkmPQgocfJbxP6EmTo5UUXMot ✅ Corey's Public Amazon Wishlist http://a.co/inIyro1 ✅ Equipment I Use and Books I Recommend: https://www.amazon.com/shop/coreyschafer ▶️ You Can Find Me On: My Website - http://coreyms.com/ My Second Channel - https://www.youtube.com/c/coreymschafer Facebook - https://www.facebook.com/CoreyMSchafer Twitter - https://twitter.com/CoreyMSchafer Instagram - https://www.instagram.com/coreymschafer/ #Python","python,context managers,context manager,python context manager,with,with statement,python with,python context,contextlib,contextmanager,python tutorial,context manager tutorial,__enter__,__exit__,corey schafer,python 3.6,python 3",27,"Education","Knowledge,Technology","false"
"Corey Schafer","CtgkEaeOkew","Channel Update: Look Back on the Year and Big Plans for 2018",2017-12-18,"17:00:00","04:13","Other",6337,504,67,"en","In this Channel Update, we will be looking back on 2017 and what we've done this year. We will also be looking forward to 2018 and discussing the future plans for this channel. This year was the best year for this channel yet and I can't thank you all enough. I have plenty planned for the future and I look forward to putting out great tutorials next year! ✅ Support My Channel Through Patreon: https://www.patreon.com/coreyms ✅ Become a Channel Member: https://www.youtube.com/channel/UCCezIgC97PvUuR4_gbFUs5g/join ✅ One-Time Contribution Through PayPal: https://goo.gl/649HFY ✅ Cryptocurrency Donations: Bitcoin Wallet - 3MPH8oY2EAgbLVy7RBMinwcBntggi7qeG3 Ethereum Wallet - 0x151649418616068fB46C3598083817101d3bCD33 Litecoin Wallet - MPvEBY5fxGkmPQgocfJbxP6EmTo5UUXMot ✅ Corey's Public Amazon Wishlist http://a.co/inIyro1 ✅ Equipment I Use and Books I Recommend: https://www.amazon.com/shop/coreyschafer ▶️ You Can Find Me On: My Website - http://coreyms.com/ My Second Channel - https://www.youtube.com/c/coreymschafer Facebook - https://www.facebook.com/CoreyMSchafer Twitter - https://twitter.com/CoreyMSchafer Instagram - https://www.instagram.com/coreymschafer/","corey schafer,channel update,patreon,update,coreyms,python,programming tutorials,year in review,year-in-review,software engineering,computer science",27,"Education","Hobby,Lifestyle_(sociology)","false"
"Corey Schafer","9N6a-VLBa2I","Python Tutorial: Working with JSON Data using the json Module",2017-11-20,"19:00:01","20:34","Python",1120454,23627,735,"en","In this Python Programming Tutorial, we will be learning how to work with JSON data. We will learn how to load JSON into Python objects from strings and how to convert Python objects into JSON strings. We will also see how to load JSON from a file and save those Python objects back to files. Let's get started... The code from this video can be found at: https://github.com/CoreyMSchafer/code_snippets/tree/master/Python-JSON Python File Objects: https://youtu.be/Uh2ebFW8OYM ✅ Support My Channel Through Patreon: https://www.patreon.com/coreyms ✅ Become a Channel Member: https://www.youtube.com/channel/UCCezIgC97PvUuR4_gbFUs5g/join ✅ One-Time Contribution Through PayPal: https://goo.gl/649HFY ✅ Cryptocurrency Donations: Bitcoin Wallet - 3MPH8oY2EAgbLVy7RBMinwcBntggi7qeG3 Ethereum Wallet - 0x151649418616068fB46C3598083817101d3bCD33 Litecoin Wallet - MPvEBY5fxGkmPQgocfJbxP6EmTo5UUXMot ✅ Corey's Public Amazon Wishlist http://a.co/inIyro1 ✅ Equipment I Use and Books I Recommend: https://www.amazon.com/shop/coreyschafer ▶️ You Can Find Me On: My Website - http://coreyms.com/ My Second Channel - https://www.youtube.com/c/coreymschafer Facebook - https://www.facebook.com/CoreyMSchafer Twitter - https://twitter.com/CoreyMSchafer Instagram - https://www.instagram.com/coreymschafer/ #Python","json,python,python json,python json tutorial,python tutorial,json tutorial,json file,json string,python string,json parsing,parse json,json module,python json dictionary,python json example,json api,python api,json loads,json load,json dumps,json dump,python 3.6,python 3,python (programming language),data,tutorial,corey schafer",27,"Education","Knowledge,Technology","false"
"Corey Schafer","ng2o98k983k","Python Tutorial: Web Scraping with BeautifulSoup and Requests",2017-11-08,"17:30:00","45:48","Python",1101209,23659,1119,"en","In this Python Programming Tutorial, we will be learning how to scrape websites using the BeautifulSoup library. BeautifulSoup is an excellent tool for parsing HTML code and grabbing exactly the information you need. So whether you're pulling down headlines from news sites, scores from sports websites, or prices from an online store... BeautifulSoup and Python will help you get this done quickly and easily. Let's get started... The code from this video can be found at: https://github.com/CoreyMSchafer/code_snippets/tree/master/BeautifulSoup Difference Between Parsers: https://goo.gl/zdy9br Python File Objects: https://youtu.be/Uh2ebFW8OYM Python Strings: https://youtu.be/k9TUPpGqYTo Python Try/Except: https://youtu.be/NIWwJbo-9_8 Python CSV Files: https://youtu.be/q5uM4VKywbA ✅ Support My Channel Through Patreon: https://www.patreon.com/coreyms ✅ Become a Channel Member: https://www.youtube.com/channel/UCCezIgC97PvUuR4_gbFUs5g/join ✅ One-Time Contribution Through PayPal: https://goo.gl/649HFY ✅ Cryptocurrency Donations: Bitcoin Wallet - 3MPH8oY2EAgbLVy7RBMinwcBntggi7qeG3 Ethereum Wallet - 0x151649418616068fB46C3598083817101d3bCD33 Litecoin Wallet - MPvEBY5fxGkmPQgocfJbxP6EmTo5UUXMot ✅ Corey's Public Amazon Wishlist http://a.co/inIyro1 ✅ Equipment I Use and Books I Recommend: https://www.amazon.com/shop/coreyschafer ▶️ You Can Find Me On: My Website - http://coreyms.com/ My Second Channel - https://www.youtube.com/c/coreymschafer Facebook - https://www.facebook.com/CoreyMSchafer Twitter - https://twitter.com/CoreyMSchafer Instagram - https://www.instagram.com/coreymschafer/ #Python","python,beautifulsoup,web scraping,scraping,python beautifulsoup,python web scraping,python html,python html parsing,web crawler,python requests,requests,string parsing,parse html,bs4,beautifulsoup4,split,python split,lxml,html5lib,python csv,csv,corey schafer,python3,programming tutorial,python programming,software engineering,python tutorial,python 3.6,python 3",27,"Education","Knowledge,Technology","false"
"Corey Schafer","K8L6KVGG-7o","Python Tutorial: re Module - How to Write and Match Regular Expressions (Regex)",2017-10-24,"16:30:00","53:18","Python",1079134,26429,1211,"en","In this Python Programming Tutorial, we will be learning how to read, write, and match regular expressions with the re module. Regular expressions are extremely useful for matching common patterns of text such as email addresses, phone numbers, URLs, etc. Learning how to do this within Python will allow us to quickly parse files and text for the information we need. Let's get started... The code from this video can be found at: https://github.com/CoreyMSchafer/code_snippets/tree/master/Python-Regular-Expressions Python String Slicing Tutorial: https://youtu.be/ajrtAuDg3yw Python Files Tutorial: https://youtu.be/Uh2ebFW8OYM ✅ Support My Channel Through Patreon: https://www.patreon.com/coreyms ✅ Become a Channel Member: https://www.youtube.com/channel/UCCezIgC97PvUuR4_gbFUs5g/join ✅ One-Time Contribution Through PayPal: https://goo.gl/649HFY ✅ Cryptocurrency Donations: Bitcoin Wallet - 3MPH8oY2EAgbLVy7RBMinwcBntggi7qeG3 Ethereum Wallet - 0x151649418616068fB46C3598083817101d3bCD33 Litecoin Wallet - MPvEBY5fxGkmPQgocfJbxP6EmTo5UUXMot ✅ Corey's Public Amazon Wishlist http://a.co/inIyro1 ✅ Equipment I Use and Books I Recommend: https://www.amazon.com/shop/coreyschafer ▶️ You Can Find Me On: My Website - http://coreyms.com/ My Second Channel - https://www.youtube.com/c/coreymschafer Facebook - https://www.facebook.com/CoreyMSchafer Twitter - https://twitter.com/CoreyMSchafer Instagram - https://www.instagram.com/coreymschafer/ #Python","python,regular expressions,regex,re module,python re,python regular expressions,python re module,python regex,python regex module,regular expression,re,python tutorial,python 3.6,corey schafer,programming tutorials,python programming,match patterns,software engineering",27,"Education","Knowledge","false"
"Corey Schafer","qE77MbDnljA","Linux/Mac Terminal Tutorial: How To Use The rsync Command - Sync Files Locally and Remotely",2017-10-10,"16:30:06","17:55","Mac",169360,4999,180,"en","In this Linux/Mac terminal tutorial, we will be learning how to use the rsync command. The rsync command will allow you to sync file and directories on your local machine or even over a network between servers. This is a great tool for running back ups, for only copying diffs, or even for deploying segments of code. Let's get started. VirtualBox Network with SSH: https://youtu.be/S7jD6nnYJy0 Key-Based Authentication: https://youtu.be/vpk_1gldOAE Cron Jobs: https://youtu.be/QZJ1drMQz1A ✅ Support My Channel Through Patreon: https://www.patreon.com/coreyms ✅ Become a Channel Member: https://www.youtube.com/channel/UCCezIgC97PvUuR4_gbFUs5g/join ✅ One-Time Contribution Through PayPal: https://goo.gl/649HFY ✅ Cryptocurrency Donations: Bitcoin Wallet - 3MPH8oY2EAgbLVy7RBMinwcBntggi7qeG3 Ethereum Wallet - 0x151649418616068fB46C3598083817101d3bCD33 Litecoin Wallet - MPvEBY5fxGkmPQgocfJbxP6EmTo5UUXMot ✅ Corey's Public Amazon Wishlist http://a.co/inIyro1 ✅ Equipment I Use and Books I Recommend: https://www.amazon.com/shop/coreyschafer ▶️ You Can Find Me On: My Website - http://coreyms.com/ My Second Channel - https://www.youtube.com/c/coreymschafer Facebook - https://www.facebook.com/CoreyMSchafer Twitter - https://twitter.com/CoreyMSchafer Instagram - https://www.instagram.com/coreymschafer/ #Linux #Mac","rsync,linux rsync,how to rsync,rsync command,mac rsync,rsync tutorial,linux,mac,os x,terminal,backup,rsync backup,linux tutorial,mac tutorial,cli,command line,unix,automated backups,server,ssh,sync remote,sync server,server backup,ssh backup,system administrator,sys admin,corey schafer",27,"Education","Knowledge,Technology","false"
"Corey Schafer","sa-TUpSx1JA","Regular Expressions (Regex) Tutorial: How to Match Any Pattern of Text",2017-10-05,"16:30:01","37:55","Other",1266083,36522,1917,"en","In this regular expressions (regex) tutorial, we're going to be learning how to match patterns of text. Regular expressions are extremely useful for matching common patterns of text such as email addresses, phone numbers, URLs, etc. Almost every programming language has a regular expression library, so learning regular expressions with not only help you with finding patterns in your text editors, but also you'll be able to use these programming libraries to search for patterns programmatically as well. Let's get started... The code from this video can be found at: https://github.com/CoreyMSchafer/code_snippets/tree/master/Regular-Expressions Python Regex Tutorial: https://youtu.be/K8L6KVGG-7o ✅ Support My Channel Through Patreon: https://www.patreon.com/coreyms ✅ Become a Channel Member: https://www.youtube.com/channel/UCCezIgC97PvUuR4_gbFUs5g/join ✅ One-Time Contribution Through PayPal: https://goo.gl/649HFY ✅ Cryptocurrency Donations: Bitcoin Wallet - 3MPH8oY2EAgbLVy7RBMinwcBntggi7qeG3 Ethereum Wallet - 0x151649418616068fB46C3598083817101d3bCD33 Litecoin Wallet - MPvEBY5fxGkmPQgocfJbxP6EmTo5UUXMot ✅ Corey's Public Amazon Wishlist http://a.co/inIyro1 ✅ Equipment I Use and Books I Recommend: https://www.amazon.com/shop/coreyschafer ▶️ You Can Find Me On: My Website - http://coreyms.com/ My Second Channel - https://www.youtube.com/c/coreymschafer Facebook - https://www.facebook.com/CoreyMSchafer Twitter - https://twitter.com/CoreyMSchafer Instagram - https://www.instagram.com/coreymschafer/","regular expressions,regex,regular expression,regexs,regexp,rational expression,computer science,python,java,javascript,programming,string,strings,text,pattern matching,match patterns,python re,javascript regular expressions,java regular expressions,python regular expressions,corey schafer,software engineering,tutorial",27,"Education","Knowledge,Technology","true"
"Corey Schafer","TtIJEQ6D9DE","5 Essential Skills Every Well-Rounded Programmer Should Know",2017-09-19,"16:30:00","11:04","Other",247895,8688,206,"en","In this video, we will be looking at 5 skills that you can learn on top of your main programming language to make you a well-rounded programmer. These skills will make you more marketable when looking for a job, and can sometimes be the deciding factor when choosing between candidates. TLDR (TLDW?): 1. Version Control (Git) 2. Databases (SQL) 3. Command Line (Terminal) 4. Unit Testing (continuous integration) 5. Multiple languages Git Tutorial for Beginners: https://youtu.be/HVsySz-h9r4 SQL Tutorial for Beginners: https://youtu.be/xaWlS9HtWYw Terminal Tutorial Playlist: https://www.youtube.com/playlist?list=PL-osiE80TeTvGhHkpvfmKWOiIPF8UVy6c Unit Testing in Python: https://youtu.be/6tNS--WetLI ✅ Support My Channel Through Patreon: https://www.patreon.com/coreyms ✅ Become a Channel Member: https://www.youtube.com/channel/UCCezIgC97PvUuR4_gbFUs5g/join ✅ One-Time Contribution Through PayPal: https://goo.gl/649HFY ✅ Cryptocurrency Donations: Bitcoin Wallet - 3MPH8oY2EAgbLVy7RBMinwcBntggi7qeG3 Ethereum Wallet - 0x151649418616068fB46C3598083817101d3bCD33 Litecoin Wallet - MPvEBY5fxGkmPQgocfJbxP6EmTo5UUXMot ✅ Corey's Public Amazon Wishlist http://a.co/inIyro1 ✅ Equipment I Use and Books I Recommend: https://www.amazon.com/shop/coreyschafer ▶️ You Can Find Me On: My Website - http://coreyms.com/ My Second Channel - https://www.youtube.com/c/coreymschafer Facebook - https://www.facebook.com/CoreyMSchafer Twitter - https://twitter.com/CoreyMSchafer Instagram - https://www.instagram.com/coreymschafer/","programming,python,javascript,java,developer,programming skills,git,sql,database,databases,unit testing,jenkins,travisci,software engineering,programming job,programming interview,software engineering interview,corey schafer,programmer,skills,essential skills",27,"Education","Knowledge,Technology","false"
"Corey Schafer","ZB7c00QgmdQ","Corey Schafer Live Stream",2017-09-15,"23:58:25","00:00","Other",0,0,0,"","","",27,"Education","","false"
"Corey Schafer","cY2NXB_Tqq0","Python Tutorial: How I Manage Multiple Projects, Virtual Environments, and Environment Variables",2017-09-06,"16:30:01","20:49","Python",141229,2288,81,"en","In this Python Programming Tutorial, I will be showing how I personally manage multiple projects, virtual environments, and environment variables. If you have ever worked on multiple projects, you probably know that it can be a hassle to keep all of your dependencies and project information separate. The strategy I have adopted over the years allows me to easily separate out my environments in such a way that they can be easily exported, activated, and also automatically activate the correct environment variables. Let's get started... The workflow I follow: https://conda.io/docs/user-guide/tasks/manage-environments.html Anaconda Intro Video: https://youtu.be/YJC6ldI3hWk The original conda_auto_env code I modified can be found here: https://github.com/chdoig/conda-auto-env/blob/master/conda_auto_env.sh My modified version of conda_auto_env: https://github.com/CoreyMSchafer/code_snippets/blob/master/conda_auto_env.sh ✅ Support My Channel Through Patreon: https://www.patreon.com/coreyms ✅ Become a Channel Member: https://www.youtube.com/channel/UCCezIgC97PvUuR4_gbFUs5g/join ✅ One-Time Contribution Through PayPal: https://goo.gl/649HFY ✅ Cryptocurrency Donations: Bitcoin Wallet - 3MPH8oY2EAgbLVy7RBMinwcBntggi7qeG3 Ethereum Wallet - 0x151649418616068fB46C3598083817101d3bCD33 Litecoin Wallet - MPvEBY5fxGkmPQgocfJbxP6EmTo5UUXMot ✅ Corey's Public Amazon Wishlist http://a.co/inIyro1 ✅ Equipment I Use and Books I Recommend: https://www.amazon.com/shop/coreyschafer ▶️ You Can Find Me On: My Website - http://coreyms.com/ My Second Channel - https://www.youtube.com/c/coreymschafer Facebook - https://www.facebook.com/CoreyMSchafer Twitter - https://twitter.com/CoreyMSchafer Instagram - https://www.instagram.com/coreymschafer/ #Python","python tutorial,python virtual environment,python anaconda,python conda,virtual environment,anaconda,continuum analytics,python project,python environment variable,environment variables,python,python 3,data science,python data science,python tutorials,programming tutorials,corey schafer,python (programming language),python 3.6,python programming",27,"Education","Knowledge,Technology","false"
"Corey Schafer","KzqSDvzOFNA","Python Tutorial: Generate Random Numbers and Data Using the random Module",2017-08-29,"17:00:01","13:37","Python",477432,10656,421,"en","In this Python Programming Tutorial, we will be learning how to generate random numbers and choose random data from lists using the random module. I personally use the random module pretty often in my tutorials to generate random data. This can also be used be games, simulations, and plenty of other useful tasks. Let's get started. The code from this video can be found at: https://github.com/CoreyMSchafer/code_snippets/tree/master/Python-Random ✅ Support My Channel Through Patreon: https://www.patreon.com/coreyms ✅ Become a Channel Member: https://www.youtube.com/channel/UCCezIgC97PvUuR4_gbFUs5g/join ✅ One-Time Contribution Through PayPal: https://goo.gl/649HFY ✅ Cryptocurrency Donations: Bitcoin Wallet - 3MPH8oY2EAgbLVy7RBMinwcBntggi7qeG3 Ethereum Wallet - 0x151649418616068fB46C3598083817101d3bCD33 Litecoin Wallet - MPvEBY5fxGkmPQgocfJbxP6EmTo5UUXMot ✅ Corey's Public Amazon Wishlist http://a.co/inIyro1 ✅ Equipment I Use and Books I Recommend: https://www.amazon.com/shop/coreyschafer ▶️ You Can Find Me On: My Website - http://coreyms.com/ My Second Channel - https://www.youtube.com/c/coreymschafer Facebook - https://www.facebook.com/CoreyMSchafer Twitter - https://twitter.com/CoreyMSchafer Instagram - https://www.instagram.com/coreymschafer/ #Python","python,random,python random,random module,python random module,random number generator,generate random numbers,generate random data,generate random values,random data,random values,random numbers,python (programming language),python 3,python 3.6,python programming,python tutorial,python for beginners,numbers",27,"Education","Knowledge","false"
"Corey Schafer","QZJ1drMQz1A","Linux/Mac Tutorial: Cron Jobs - How to Schedule Commands with crontab",2017-08-23,"16:00:03","18:51","Mac",244000,6220,272,"en","In this Linux/Mac terminal tutorial, we will be learning about cron jobs and how to schedule commands with crontab. The will allow you to run commands on a repetitive schedule. So if you want to run a job daily, weekly, or at a certain time of day, this video will show you how you can get this set up. This helps a ton with system administration type of tasks and can automate a lot of work. Let's get started. The snippets from this video can be found at: https://github.com/CoreyMSchafer/code_snippets/tree/master/Cron-Tasks ✅ Support My Channel Through Patreon: https://www.patreon.com/coreyms ✅ Become a Channel Member: https://www.youtube.com/channel/UCCezIgC97PvUuR4_gbFUs5g/join ✅ One-Time Contribution Through PayPal: https://goo.gl/649HFY ✅ Cryptocurrency Donations: Bitcoin Wallet - 3MPH8oY2EAgbLVy7RBMinwcBntggi7qeG3 Ethereum Wallet - 0x151649418616068fB46C3598083817101d3bCD33 Litecoin Wallet - MPvEBY5fxGkmPQgocfJbxP6EmTo5UUXMot ✅ Corey's Public Amazon Wishlist http://a.co/inIyro1 ✅ Equipment I Use and Books I Recommend: https://www.amazon.com/shop/coreyschafer ▶️ You Can Find Me On: My Website - http://coreyms.com/ My Second Channel - https://www.youtube.com/c/coreymschafer Facebook - https://www.facebook.com/CoreyMSchafer Twitter - https://twitter.com/CoreyMSchafer Instagram - https://www.instagram.com/coreymschafer/ #Linux #Mac","cron,cron job,cron task,crontab,linux,mac,os x,terminal,linux cron,linux crontab,linux cron job,cron jobs,tutorial,corey schafer,unix,command line,linux schedule,linux automate,cli,command-line,how to cron,how to schedule cron,cron tutorial,system administration,sys admin",27,"Education","Knowledge,Technology","false"
"Corey Schafer","6tNS--WetLI","Python Tutorial: Unit Testing Your Code with the unittest Module",2017-08-16,"16:00:01","39:13","Python",1308610,25012,680,"en","In this Python Programming Tutorial, we will be learning how to unit-test our code using the unittest module. Unit testing will allow you to be more comfortable with refactoring and knowing whether or not your updates broke any of your existing code. Unit testing is a must on any large projects and is used by all major companies. Not only that, but it will greatly improve your personal code as well. Let's get started. The code from this video can be found at: https://github.com/CoreyMSchafer/code_snippets/tree/master/Python-Unit-Testing Unittest assert methods: https://docs.python.org/3/library/unittest.html#unittest.TestCase.debug if __name__ == '__main__' video: https://www.youtube.com/watch?v=sugvnHA7ElY OOP Series: https://www.youtube.com/playlist?list=PL-osiE80TeTsqhIuOqKhwlXsIBIdSeYtc ✅ Support My Channel Through Patreon: https://www.patreon.com/coreyms ✅ Become a Channel Member: https://www.youtube.com/channel/UCCezIgC97PvUuR4_gbFUs5g/join ✅ One-Time Contribution Through PayPal: https://goo.gl/649HFY ✅ Cryptocurrency Donations: Bitcoin Wallet - 3MPH8oY2EAgbLVy7RBMinwcBntggi7qeG3 Ethereum Wallet - 0x151649418616068fB46C3598083817101d3bCD33 Litecoin Wallet - MPvEBY5fxGkmPQgocfJbxP6EmTo5UUXMot ✅ Corey's Public Amazon Wishlist http://a.co/inIyro1 ✅ Equipment I Use and Books I Recommend: https://www.amazon.com/shop/coreyschafer ▶️ You Can Find Me On: My Website - http://coreyms.com/ My Second Channel - https://www.youtube.com/c/coreymschafer Facebook - https://www.facebook.com/CoreyMSchafer Twitter - https://twitter.com/CoreyMSchafer Instagram - https://www.instagram.com/coreymschafer/ #Python","python,python tutorial,unit test,unittest,unit testing,python unittest,python unit testing,python unit test,how to write unit tests,testing,python for beginners,python 3,corey schafer,python (programming language),python 3.6,python programming,unittest module",27,"Education","Knowledge,Technology","false"
"Corey Schafer","q5uM4VKywbA","Python Tutorial: CSV Module - How to Read, Parse, and Write CSV Files",2017-08-09,"16:00:06","16:12","Python",1230698,20617,732,"en","In this Python Programming Tutorial, we will be learning how to work with csv files using the csv module. We will learn how to read, parse, and write to csv files. CSV stands for ""Comma-Separated Values"". It is a common format for storing information. Knowing how to read, parse, and write this information to files will open the door to working with a lot of data throughout the world. Let's get started. The code from this video can be found at: https://github.com/CoreyMSchafer/code_snippets/tree/master/Python-CSV ✅ Support My Channel Through Patreon: https://www.patreon.com/coreyms ✅ Become a Channel Member: https://www.youtube.com/channel/UCCezIgC97PvUuR4_gbFUs5g/join ✅ One-Time Contribution Through PayPal: https://goo.gl/649HFY ✅ Cryptocurrency Donations: Bitcoin Wallet - 3MPH8oY2EAgbLVy7RBMinwcBntggi7qeG3 Ethereum Wallet - 0x151649418616068fB46C3598083817101d3bCD33 Litecoin Wallet - MPvEBY5fxGkmPQgocfJbxP6EmTo5UUXMot ✅ Corey's Public Amazon Wishlist http://a.co/inIyro1 ✅ Equipment I Use and Books I Recommend: https://www.amazon.com/shop/coreyschafer ▶️ You Can Find Me On: My Website - http://coreyms.com/ My Second Channel - https://www.youtube.com/c/coreymschafer Facebook - https://www.facebook.com/CoreyMSchafer Twitter - https://twitter.com/CoreyMSchafer Instagram - https://www.instagram.com/coreymschafer/ #Python","python,python tutorial,python csv,csv module,csv file,csv files,comma-separated values,comma separated values,csv,python for beginners,corey schafer,python (programming language),python 3,python 3.6,python programming,python comma-separated values,parse csv,read csv,write csv,python parsing,python basics,python csv module",27,"Education","Knowledge,Technology","true"
